{
  "workspace": {
    "id": "fixture-workspace-root",
    "enabled": true,
    "description": "Migrated single project at repository root"
  },
  "projects": [
    {
      "id": "proj-default",
      "name": "Acme Portal",
      "path": ".",
      "type": "greenfield",
      "status": "phase-1",
      "created_at": "2026-06-01T00:00:00Z",
      "config_path": ".jumpstart/config.yaml",
      "phase": 1,
      "approver": "Taylor",
      "locked": false,
      "lock_reason": null
    }
  ],
  "active_project": "proj-default",
  "settings": {
    "enforce_sequential_phases": true,
    "allow_parallel_projects": false,
    "pit_crew_review_required": true,
    "cross_project_dependency_validation": true,
    "aggregate_cost_tracking": true
  },
  "version": "1.0.0",
  "last_updated": "2026-06-01T00:00:00Z"
}